{
  "version": "1.0",
  "timestamp": "2024-01-15T11:10:00Z",
  "checkpoint_ref": "a1b2c3d",
  "executor": "cc-ds4",
  "review_round": 1,
  "reviewers_total": 2,
  "reviewers_responded": 2,
  "votes": [
    { "reviewer": "cc-glm", "vote": "YES_APPROVE", "issues_count": 0 },
    { "reviewer": "kimi", "vote": "NO_APPROVE", "issues_count": 3 }
  ],
  "consensus_rule": "2/3 majority + minimum quorum",
  "vote_breakdown": { "approve": 1, "reject": 1, "abstain": 0 },
  "input_artifacts": [
    { "kind": "review_manifest", "path": ".macao/.reviews/cc-glm.review.yml", "sha256": "e3b0c44298fc1c149afbf4c8996fb92427ae41e4649b934ca495991b7852b855", "message_id": "msg-20240115-005" },
    { "kind": "review_manifest", "path": ".macao/.reviews/kimi.review.yml", "sha256": "e3b0c44298fc1c149afbf4c8996fb92427ae41e4649b934ca495991b7852b855", "message_id": "msg-20240115-006" }
  ],
  "decision": "APPROVED",
  "resolution": "human_override",
  "summary": {
    "critical_issues": 0,
    "major_issues": 1,
    "minor_issues": 2,
    "action": "1:1 deadlock overridden by user ruling (E7)"
  },
  "next_step": { "action": "MERGE", "deadline": "2024-01-15T11:30:00Z" }
}